{
  "schema_version": 1,
  "producer_command": "manual checked-in product-source artifact",
  "registry_id": "self-hosting-procedure-registry",
  "canonical_root": "skills/self-hosting/",
  "discovery_targets": [
    {
      "path": ".agents/skills/**",
      "authority": "non-authoritative",
      "purpose": "optional repo-local discovery or sync target"
    },
    {
      "path": "$HOME/.agents/skills/**",
      "authority": "non-authoritative",
      "purpose": "optional user-level install target"
    }
  ],
  "procedures": [
    {
      "procedure_id": "feature-decomposition",
      "title": "Feature Decomposition",
      "purpose": "Break a broad request into ordered task-contract proposals without implementation.",
      "canonical_source_path": "skills/self-hosting/feature-decomposition/",
      "skill_path": "skills/self-hosting/feature-decomposition/SKILL.md",
      "source_notes_path": "skills/self-hosting/feature-decomposition/references/source-notes.md",
      "output_format_path": "skills/self-hosting/feature-decomposition/references/output-format.md",
      "required_inputs": [
        "broad request",
        "current TASK.md",
        "roadmap and boundary docs",
        "constraints and non-goals"
      ],
      "blocker_conditions": [
        "request is already one active task",
        "required roadmap or boundary docs are unavailable",
        "request is too ambiguous to define task proposals responsibly"
      ],
      "evidence_to_record": [
        "task-contract proposals",
        "dependency and risk ordering",
        "recommended first active task",
        "open questions and explicit non-goals"
      ],
      "phase_24_packet_dependencies": [
        "planner packet"
      ],
      "authority_level": "binding",
      "generated_or_install_targets_non_authoritative": true,
      "operator_contract": {
        "primary_outputs": [
          "task-contract proposals"
        ],
        "allowed_outcome_states": [
          "task_proposals_ready",
          "blocked"
        ]
      },
      "phase_23_5_dependencies": [
        "Phase 23.5 lifecycle and accepted-memory authority stay unchanged during pre-implementation planning."
      ],
      "prompt_wrapper_path": "prompts/self-hosting/feature-decomposition.md"
    },
    {
      "procedure_id": "task-intake",
      "title": "Task Intake",
      "purpose": "Normalize an active task into a stable implementation contract before planning.",
      "canonical_source_path": "skills/self-hosting/task-intake/",
      "skill_path": "skills/self-hosting/task-intake/SKILL.md",
      "source_notes_path": "skills/self-hosting/task-intake/references/source-notes.md",
      "output_format_path": "skills/self-hosting/task-intake/references/output-format.md",
      "required_inputs": [
        "current TASK.md",
        "active task file",
        "acceptance and boundary docs",
        "repo constraints and non-goals"
      ],
      "blocker_conditions": [
        "active task file is missing or unreadable",
        "scope and acceptance are too ambiguous to plan safely",
        "repo-owned docs contradict the task materially"
      ],
      "evidence_to_record": [
        "normalized task contract",
        "explicit scope and non-goals",
        "validation expectations",
        "blocking contradictions or open questions"
      ],
      "phase_24_packet_dependencies": [
        "planner packet"
      ],
      "authority_level": "binding",
      "generated_or_install_targets_non_authoritative": true,
      "operator_contract": {
        "primary_outputs": [
          "normalized task contract"
        ],
        "allowed_outcome_states": [
          "task_contract_ready",
          "blocked"
        ]
      },
      "phase_23_5_dependencies": [
        "Phase 23.5 lifecycle and accepted-memory authority stay unchanged during pre-implementation planning."
      ],
      "prompt_wrapper_path": "prompts/self-hosting/task-intake.md"
    },
    {
      "procedure_id": "task-prompt-writer",
      "title": "Task Prompt Writer",
      "purpose": "Produce invocation-ready guidance derived from repo-owned procedures and task contracts.",
      "canonical_source_path": "skills/self-hosting/task-prompt-writer/",
      "skill_path": "skills/self-hosting/task-prompt-writer/SKILL.md",
      "source_notes_path": "skills/self-hosting/task-prompt-writer/references/source-notes.md",
      "output_format_path": "skills/self-hosting/task-prompt-writer/references/output-format.md",
      "required_inputs": [
        "task contract",
        "relevant procedure contract",
        "required reading and validation commands",
        "repo boundary and non-goals"
      ],
      "blocker_conditions": [
        "task contract or procedure contract is missing",
        "task is not specific enough to write a bounded invocation wrapper",
        "validation or scope boundaries are unknown"
      ],
      "evidence_to_record": [
        "prompt wrapper or prompt review summary",
        "referenced task and procedure inputs",
        "missing inputs or contradictions"
      ],
      "phase_24_packet_dependencies": [
        "planner packet"
      ],
      "authority_level": "binding",
      "generated_or_install_targets_non_authoritative": true,
      "operator_contract": {
        "primary_outputs": [
          "bounded invocation wrapper"
        ],
        "allowed_outcome_states": [
          "prompt_ready",
          "blocked"
        ]
      },
      "phase_23_5_dependencies": [
        "Phase 23.5 lifecycle and accepted-memory authority stay unchanged during pre-implementation planning."
      ],
      "prompt_wrapper_path": "prompts/self-hosting/task-prompt-writer.md"
    },
    {
      "procedure_id": "draft-plan",
      "title": "Draft Plan",
      "purpose": "Produce a decision-complete, agent-legible candidate execution plan without editing files or starting execution.",
      "canonical_source_path": "skills/self-hosting/draft-plan/",
      "skill_path": "skills/self-hosting/draft-plan/SKILL.md",
      "source_notes_path": "skills/self-hosting/draft-plan/references/source-notes.md",
      "output_format_path": "skills/self-hosting/draft-plan/references/output-format.md",
      "required_inputs": [
        "normalized task contract",
        "prior procedure artifacts for the current run",
        "relevant roadmap and boundary docs",
        "validation commands and acceptance expectations",
        "known risks, assumptions, and open questions"
      ],
      "blocker_conditions": [
        "acceptance or boundary rules are too ambiguous to plan safely",
        "key implementation choices depend on missing repo facts",
        "the task already requires decomposition instead of direct planning",
        "required source surfaces, validation signals, or stop conditions cannot be identified from repo-owned inputs"
      ],
      "evidence_to_record": [
        "draft plan",
        "implementation surfaces",
        "open engineering questions",
        "assumptions and risks",
        "reviewer policy checks",
        "validation matrix",
        "stop conditions and implementation handoff criteria",
        "explicit out-of-scope items"
      ],
      "phase_24_packet_dependencies": [
        "planner packet"
      ],
      "authority_level": "binding",
      "generated_or_install_targets_non_authoritative": true,
      "operator_contract": {
        "primary_outputs": [
          "candidate execution plan",
          "implementation surfaces",
          "validation matrix",
          "stop conditions and implementation handoff criteria",
          "recommended defaults",
          "real operator choices only when needed"
        ],
        "allowed_outcome_states": [
          "candidate_execution_plan",
          "blocked"
        ],
        "real_operator_choices_only": true
      },
      "phase_23_5_dependencies": [
        "Phase 23.5 lifecycle and accepted-memory authority stay unchanged during pre-implementation planning."
      ],
      "prompt_wrapper_path": "prompts/self-hosting/draft-plan.md"
    },
    {
      "procedure_id": "plan-review",
      "title": "Plan Review",
      "purpose": "Independently review a draft plan before implementation begins and preserve a durable decision record.",
      "canonical_source_path": "skills/self-hosting/plan-review/",
      "skill_path": "skills/self-hosting/plan-review/SKILL.md",
      "source_notes_path": "skills/self-hosting/plan-review/references/source-notes.md",
      "output_format_path": "skills/self-hosting/plan-review/references/output-format.md",
      "required_inputs": [
        "draft plan",
        "active task contract",
        "relevant boundary and acceptance docs",
        "review intensity tier"
      ],
      "blocker_conditions": [
        "plan is missing key implementation or validation details",
        "review intensity tier is unknown for a high-risk task",
        "required policy controls are missing from the plan",
        "repo-owned docs contradict the plan materially"
      ],
      "evidence_to_record": [
        "human-readable review report",
        "durable review decision record",
        "policy control check",
        "blockers and residual risks",
        "pass or amend recommendation"
      ],
      "phase_24_packet_dependencies": [
        "plan-review packet"
      ],
      "authority_level": "binding",
      "generated_or_install_targets_non_authoritative": true,
      "operator_contract": {
        "primary_outputs": [
          "human-readable review report",
          "durable review decision record"
        ],
        "allowed_outcome_states": [
          "ready_for_implementation",
          "decision_required",
          "needs_contract_surface_update",
          "blocked"
        ],
        "durable_decision_fields": [
          "verdict",
          "outcome_state",
          "blocking_findings",
          "required_amendments",